{
  "bindings": {
    "contextDigest": null,
    "environmentDigest": null,
    "sourceRevision": "bc72d1966823f9e841b7e65b0e0cb6ca80344213",
    "systemSnapshotRef": null,
    "toolCatalogDigest": null
  },
  "budget": {
    "maxInputTokens": null,
    "maxModelCalls": 3,
    "maxObservationBytes": 524288,
    "maxOutputTokens": null,
    "maxRuntimeJobs": 1,
    "maxToolCalls": 0,
    "maxWallTimeMs": 300000
  },
  "completedAtMs": 1785709941267,
  "executionPath": "ordivon_harness",
  "harness": {
    "harnessId": "ordivon-harness-v0",
    "harnessRevision": "p1-stress",
    "manifestDigest": "sha256:bcf1ec6bd8af83a5e250e06ec4a8a4a553622252613d4869c711cdbe59b2fb5e"
  },
  "integrity": {
    "algorithm": "sha256",
    "canonicalization": "ordivon-evidence-json-v1",
    "payloadDigest": "sha256:ac00521c68094e03dccf1246fa7b03c6bfbe6415e6d70102c6b1802bc0c50c80"
  },
  "kind": "ordivon.evaluation-trial",
  "limitations": [
    "Single high-intensity dogfood sample.",
    "Provider reasoning text was not retained."
  ],
  "model": {
    "adapterRevision": "bc72d1966823f9e841b7e65b0e0cb6ca80344213",
    "modelId": "ordivon.scripted-model.v1",
    "modelRevision": null,
    "providerId": "fixture"
  },
  "sampling": {
    "reasoningEffort": null,
    "seed": null,
    "temperature": null,
    "topP": null
  },
  "schemaVersion": 1,
  "sourceEvidenceRefs": [
    {
      "digest": "sha256:5078c04e5751448051cef2154b9271aa028d629c431c54d3550ca6a172b48ee1",
      "path": "research/evidence/host-harness-concurrent-resume-stress-004.json",
      "repositoryId": "ordivon-computing"
    }
  ],
  "startedAtMs": 1785709940737,
  "taskRef": {
    "taskId": "host-harness-concurrent-resume-stress-001",
    "taskVersion": 1
  },
  "trialId": "dogfood:20260802:concurrent-resume-stress-004"
}
